Started by user admin

[Pipeline] Start of Pipeline
[Pipeline] node
Running on Jenkins
 in /var/lib/jenkins/workspace/Demo
[Pipeline] {
[Pipeline] stage
[Pipeline] { (Declarative: Tool Install)
[Pipeline] tool
[Pipeline] envVarsForTool
[Pipeline] tool
[Pipeline] envVarsForTool
[Pipeline] }
[Pipeline] // stage
[Pipeline] withEnv
[Pipeline] {
[Pipeline] stage
[Pipeline] { (Checkout)
[Pipeline] tool
[Pipeline] envVarsForTool
[Pipeline] tool
[Pipeline] envVarsForTool
[Pipeline] withEnv
[Pipeline] {
[Pipeline] git
The recommended git tool is: NONE
No credentials specified
Cloning the remote Git repository
Cloning repository https://github.com/zatreby/jenkins-demo.git
 > git init /var/lib/jenkins/workspace/Demo # timeout=10
Fetching upstream changes from https://github.com/zatreby/jenkins-demo.git
 > git --version # timeout=10
 > git --version # 'git version 2.51.2'
 > git fetch --tags --force --progress -- https://github.com/zatreby/jenkins-demo.git +refs/heads/*:refs/remotes/origin/* # timeout=10
 > git config remote.origin.url https://github.com/zatreby/jenkins-demo.git # timeout=10
 > git config --add remote.origin.fetch +refs/heads/*:refs/remotes/origin/* # timeout=10
Avoid second fetch
 > git rev-parse refs/remotes/origin/main^{commit} # timeout=10
Checking out Revision 9500a36ee68f9b9318350004b5f51d67abb577f5 (refs/remotes/origin/main)
 > git config core.sparsecheckout # timeout=10
 > git checkout -f 9500a36ee68f9b9318350004b5f51d67abb577f5 # timeout=10
 > git branch -a -v --no-abbrev # timeout=10
 > git checkout -b main 9500a36ee68f9b9318350004b5f51d67abb577f5 # timeout=10
Commit message: "initial commit"
First time build. Skipping changelog.
[Pipeline] }
[Pipeline] // withEnv
[Pipeline] }
[Pipeline] // stage
[Pipeline] stage
[Pipeline] { (Build)
[Pipeline] tool
[Pipeline] envVarsForTool
[Pipeline] tool
[Pipeline] envVarsForTool
[Pipeline] withEnv
[Pipeline] {
[Pipeline] echo
compiling...
[Pipeline] sh
+ mvn clean compile
WARNING: A terminally deprecated method in sun.misc.Unsafe has been called
WARNING: sun.misc.Unsafe::staticFieldBase has been called by com.google.inject.internal.aop.HiddenClassDefiner (file:/var/lib/jenkins/tools/hudson.tasks.Maven_MavenInstallation/Maven/lib/guice-5.1.0-classes.jar)
WARNING: Please consider reporting this to the maintainers of class com.google.inject.internal.aop.HiddenClassDefiner
WARNING: sun.misc.Unsafe::staticFieldBase will be removed in a future release
[INFO] Scanning for projects...
[INFO] 
[INFO] -----------------------< com.example:math-utils >-----------------------
[INFO] Building math-utils 1.0-SNAPSHOT
[INFO]   from pom.xml
[INFO] --------------------------------[ jar ]---------------------------------
[INFO] 
[INFO] --- clean:3.2.0:clean (default-clean) @ math-utils ---
[INFO] 
[INFO] --- resources:3.3.1:resources (default-resources) @ math-utils ---
[INFO] skip non existing resourceDirectory /var/lib/jenkins/workspace/Demo/src/main/resources
[INFO] 
[INFO] --- compiler:3.13.0:compile (default-compile) @ math-utils ---
[INFO] Recompiling the module because of changed source code.
[INFO] Compiling 1 source file with javac [debug target 17] to target/classes
[WARNING] location of system modules is not set in conjunction with -source 17
  not setting the location of system modules may lead to class files that cannot run on JDK 17
    --release 17 is recommended instead of -source 17 -target 17 because it sets the location of system modules automatically
[INFO] ------------------------------------------------------------------------
[INFO] BUILD SUCCESS
[INFO] ------------------------------------------------------------------------
[INFO] Total time:  0.664 s
[INFO] Finished at: 2025-12-12T15:16:34+02:00
[INFO] ------------------------------------------------------------------------
[Pipeline] }
[Pipeline] // withEnv
[Pipeline] }
[Pipeline] // stage
[Pipeline] stage
[Pipeline] { (Test)
[Pipeline] tool
[Pipeline] envVarsForTool
[Pipeline] tool
[Pipeline] envVarsForTool
[Pipeline] withEnv
[Pipeline] {
[Pipeline] echo
testing...
[Pipeline] sh
+ mvn test
WARNING: A terminally deprecated method in sun.misc.Unsafe has been called
WARNING: sun.misc.Unsafe::staticFieldBase has been called by com.google.inject.internal.aop.HiddenClassDefiner (file:/var/lib/jenkins/tools/hudson.tasks.Maven_MavenInstallation/Maven/lib/guice-5.1.0-classes.jar)
WARNING: Please consider reporting this to the maintainers of class com.google.inject.internal.aop.HiddenClassDefiner
WARNING: sun.misc.Unsafe::staticFieldBase will be removed in a future release
[INFO] Scanning for projects...
[INFO] 
[INFO] -----------------------< com.example:math-utils >-----------------------
[INFO] Building math-utils 1.0-SNAPSHOT
[INFO]   from pom.xml
[INFO] --------------------------------[ jar ]---------------------------------
[INFO] 
[INFO] --- resources:3.3.1:resources (default-resources) @ math-utils ---
[INFO] skip non existing resourceDirectory /var/lib/jenkins/workspace/Demo/src/main/resources
[INFO] 
[INFO] --- compiler:3.13.0:compile (default-compile) @ math-utils ---
[INFO] Nothing to compile - all classes are up to date.
[INFO] 
[INFO] --- resources:3.3.1:testResources (default-testResources) @ math-utils ---
[INFO] skip non existing resourceDirectory /var/lib/jenkins/workspace/Demo/src/test/resources
[INFO] 
[INFO] --- compiler:3.13.0:testCompile (default-testCompile) @ math-utils ---
[INFO] Recompiling the module because of changed source code.
[INFO] Compiling 1 source file with javac [debug target 17] to target/test-classes
[WARNING] location of system modules is not set in conjunction with -source 17
  not setting the location of system modules may lead to class files that cannot run on JDK 17
    --release 17 is recommended instead of -source 17 -target 17 because it sets the location of system modules automatically
[INFO] 
[INFO] --- surefire:3.0.0-M7:test (default-test) @ math-utils ---
[INFO] Using auto detected provider org.apache.maven.surefire.junitplatform.JUnitPlatformProvider
[INFO] 
[INFO] -------------------------------------------------------
[INFO]  T E S T S
[INFO] -------------------------------------------------------
[INFO] Running com.example.math.MathUtilsTest
[ERROR] Tests run: 4, Failures: 1, Errors: 0, Skipped: 0, Time elapsed: 0.042 s <<< FAILURE! - in com.example.math.MathUtilsTest
[ERROR] com.example.math.MathUtilsTest.intentionalFailingTest  Time elapsed: 0.002 s  <<< FAILURE!
org.opentest4j.AssertionFailedError: expected: <50.0> but was: <33.33333333333333>
	at org.junit.jupiter.api.AssertionFailureBuilder.build(AssertionFailureBuilder.java:151)
	at org.junit.jupiter.api.AssertionFailureBuilder.buildAndThrow(AssertionFailureBuilder.java:132)
	at org.junit.jupiter.api.AssertEquals.failNotEqual(AssertEquals.java:197)
	at org.junit.jupiter.api.AssertEquals.assertEquals(AssertEquals.java:86)
	at org.junit.jupiter.api.AssertEquals.assertEquals(AssertEquals.java:81)
	at org.junit.jupiter.api.Assertions.assertEquals(Assertions.java:1011)
	at com.example.math.MathUtilsTest.intentionalFailingTest(MathUtilsTest.java:25)
	at java.base/jdk.internal.reflect.DirectMethodHandleAccessor.invoke(DirectMethodHandleAccessor.java:104)
	at java.base/java.lang.reflect.Method.invoke(Method.java:565)
	at org.junit.platform.commons.util.ReflectionUtils.invokeMethod(ReflectionUtils.java:727)
	at org.junit.jupiter.engine.execution.MethodInvocation.proceed(MethodInvocation.java:60)
	at org.junit.jupiter.engine.execution.InvocationInterceptorChain$ValidatingInvocation.proceed(InvocationInterceptorChain.java:131)
	at org.junit.jupiter.engine.extension.TimeoutExtension.intercept(TimeoutExtension.java:156)
	at org.junit.jupiter.engine.extension.TimeoutExtension.interceptTestableMethod(TimeoutExtension.java:147)
	at org.junit.jupiter.engine.extension.TimeoutExtension.interceptTestMethod(TimeoutExtension.java:86)
	at org.junit.jupiter.engine.execution.InterceptingExecutableInvoker$ReflectiveInterceptorCall.lambda$ofVoidMethod$0(InterceptingExecutableInvoker.java:103)
	at org.junit.jupiter.engine.execution.InterceptingExecutableInvoker.lambda$invoke$0(InterceptingExecutableInvoker.java:93)
	at org.junit.jupiter.engine.execution.InvocationInterceptorChain$InterceptedInvocation.proceed(InvocationInterceptorChain.java:106)
	at org.junit.jupiter.engine.execution.InvocationInterceptorChain.proceed(InvocationInterceptorChain.java:64)
	at org.junit.jupiter.engine.execution.InvocationInterceptorChain.chainAndInvoke(InvocationInterceptorChain.java:45)
	at org.junit.jupiter.engine.execution.InvocationInterceptorChain.invoke(InvocationInterceptorChain.java:37)
	at org.junit.jupiter.engine.execution.InterceptingExecutableInvoker.invoke(InterceptingExecutableInvoker.java:92)
	at org.junit.jupiter.engine.execution.InterceptingExecutableInvoker.invoke(InterceptingExecutableInvoker.java:86)
	at org.junit.jupiter.engine.descriptor.TestMethodTestDescriptor.lambda$invokeTestMethod$7(TestMethodTestDescriptor.java:217)
	at org.junit.platform.engine.support.hierarchical.ThrowableCollector.execute(ThrowableCollector.java:73)
	at org.junit.jupiter.engine.descriptor.TestMethodTestDescriptor.invokeTestMethod(TestMethodTestDescriptor.java:213)
	at org.junit.jupiter.engine.descriptor.TestMethodTestDescriptor.execute(TestMethodTestDescriptor.java:138)
	at org.junit.jupiter.engine.descriptor.TestMethodTestDescriptor.execute(TestMethodTestDescriptor.java:68)
	at org.junit.platform.engine.support.hierarchical.NodeTestTask.lambda$executeRecursively$6(NodeTestTask.java:151)
	at org.junit.platform.engine.support.hierarchical.ThrowableCollector.execute(ThrowableCollector.java:73)
	at org.junit.platform.engine.support.hierarchical.NodeTestTask.lambda$executeRecursively$8(NodeTestTask.java:141)
	at org.junit.platform.engine.support.hierarchical.Node.around(Node.java:137)
	at org.junit.platform.engine.support.hierarchical.NodeTestTask.lambda$executeRecursively$9(NodeTestTask.java:139)
	at org.junit.platform.engine.support.hierarchical.ThrowableCollector.execute(ThrowableCollector.java:73)
	at org.junit.platform.engine.support.hierarchical.NodeTestTask.executeRecursively(NodeTestTask.java:138)
	at org.junit.platform.engine.support.hierarchical.NodeTestTask.execute(NodeTestTask.java:95)
	at java.base/java.util.ArrayList.forEach(ArrayList.java:1604)
	at org.junit.platform.engine.support.hierarchical.SameThreadHierarchicalTestExecutorService.invokeAll(SameThreadHierarchicalTestExecutorService.java:41)
	at org.junit.platform.engine.support.hierarchical.NodeTestTask.lambda$executeRecursively$6(NodeTestTask.java:155)
	at org.junit.platform.engine.support.hierarchical.ThrowableCollector.execute(ThrowableCollector.java:73)
	at org.junit.platform.engine.support.hierarchical.NodeTestTask.lambda$executeRecursively$8(NodeTestTask.java:141)
	at org.junit.platform.engine.support.hierarchical.Node.around(Node.java:137)
	at org.junit.platform.engine.support.hierarchical.NodeTestTask.lambda$executeRecursively$9(NodeTestTask.java:139)
	at org.junit.platform.engine.support.hierarchical.ThrowableCollector.execute(ThrowableCollector.java:73)
	at org.junit.platform.engine.support.hierarchical.NodeTestTask.executeRecursively(NodeTestTask.java:138)
	at org.junit.platform.engine.support.hierarchical.NodeTestTask.execute(NodeTestTask.java:95)
	at java.base/java.util.ArrayList.forEach(ArrayList.java:1604)
	at org.junit.platform.engine.support.hierarchical.SameThreadHierarchicalTestExecutorService.invokeAll(SameThreadHierarchicalTestExecutorService.java:41)
	at org.junit.platform.engine.support.hierarchical.NodeTestTask.lambda$executeRecursively$6(NodeTestTask.java:155)
	at org.junit.platform.engine.support.hierarchical.ThrowableCollector.execute(ThrowableCollector.java:73)
	at org.junit.platform.engine.support.hierarchical.NodeTestTask.lambda$executeRecursively$8(NodeTestTask.java:141)
	at org.junit.platform.engine.support.hierarchical.Node.around(Node.java:137)
	at org.junit.platform.engine.support.hierarchical.NodeTestTask.lambda$executeRecursively$9(NodeTestTask.java:139)
	at org.junit.platform.engine.support.hierarchical.ThrowableCollector.execute(ThrowableCollector.java:73)
	at org.junit.platform.engine.support.hierarchical.NodeTestTask.executeRecursively(NodeTestTask.java:138)
	at org.junit.platform.engine.support.hierarchical.NodeTestTask.execute(NodeTestTask.java:95)
	at org.junit.platform.engine.support.hierarchical.SameThreadHierarchicalTestExecutorService.submit(SameThreadHierarchicalTestExecutorService.java:35)
	at org.junit.platform.engine.support.hierarchical.HierarchicalTestExecutor.execute(HierarchicalTestExecutor.java:57)
	at org.junit.platform.engine.support.hierarchical.HierarchicalTestEngine.execute(HierarchicalTestEngine.java:54)
	at org.junit.platform.launcher.core.EngineExecutionOrchestrator.execute(EngineExecutionOrchestrator.java:147)
	at org.junit.platform.launcher.core.EngineExecutionOrchestrator.execute(EngineExecutionOrchestrator.java:127)
	at org.junit.platform.launcher.core.EngineExecutionOrchestrator.execute(EngineExecutionOrchestrator.java:90)
	at org.junit.platform.launcher.core.EngineExecutionOrchestrator.lambda$execute$0(EngineExecutionOrchestrator.java:55)
	at org.junit.platform.launcher.core.EngineExecutionOrchestrator.withInterceptedStreams(EngineExecutionOrchestrator.java:102)
	at org.junit.platform.launcher.core.EngineExecutionOrchestrator.execute(EngineExecutionOrchestrator.java:54)
	at org.junit.platform.launcher.core.DefaultLauncher.execute(DefaultLauncher.java:114)
	at org.junit.platform.launcher.core.DefaultLauncher.execute(DefaultLauncher.java:86)
	at org.junit.platform.launcher.core.DefaultLauncherSession$DelegatingLauncher.execute(DefaultLauncherSession.java:86)
	at org.apache.maven.surefire.junitplatform.LazyLauncher.execute(LazyLauncher.java:55)
	at org.apache.maven.surefire.junitplatform.JUnitPlatformProvider.execute(JUnitPlatformProvider.java:223)
	at org.apache.maven.surefire.junitplatform.JUnitPlatformProvider.invokeAllTests(JUnitPlatformProvider.java:175)
	at org.apache.maven.surefire.junitplatform.JUnitPlatformProvider.invoke(JUnitPlatformProvider.java:139)
	at org.apache.maven.surefire.booter.ForkedBooter.runSuitesInProcess(ForkedBooter.java:456)
	at org.apache.maven.surefire.booter.ForkedBooter.execute(ForkedBooter.java:169)
	at org.apache.maven.surefire.booter.ForkedBooter.run(ForkedBooter.java:595)
	at org.apache.maven.surefire.booter.ForkedBooter.main(ForkedBooter.java:581)

[INFO] 
[INFO] Results:
[INFO] 
[ERROR] Failures: 
[ERROR]   MathUtilsTest.intentionalFailingTest:25 expected: <50.0> but was: <33.33333333333333>
[INFO] 
[ERROR] Tests run: 4, Failures: 1, Errors: 0, Skipped: 0
[INFO] 
[INFO] ------------------------------------------------------------------------
[INFO] BUILD FAILURE
[INFO] ------------------------------------------------------------------------
[INFO] Total time:  1.514 s
[INFO] Finished at: 2025-12-12T15:16:36+02:00
[INFO] ------------------------------------------------------------------------
[ERROR] Failed to execute goal org.apache.maven.plugins:maven-surefire-plugin:3.0.0-M7:test (default-test) on project math-utils: There are test failures.
[ERROR] 
[ERROR] Please refer to /var/lib/jenkins/workspace/Demo/target/surefire-reports for the individual test results.
[ERROR] Please refer to dump files (if any exist) [date].dump, [date]-jvmRun[N].dump and [date].dumpstream.
[ERROR] -> [Help 1]
[ERROR] 
[ERROR] To see the full stack trace of the errors, re-run Maven with the -e switch.
[ERROR] Re-run Maven using the -X switch to enable full debug logging.
[ERROR] 
[ERROR] For more information about the errors and possible solutions, please read the following articles:
[ERROR] [Help 1] http://cwiki.apache.org/confluence/display/MAVEN/MojoFailureException
[Pipeline] }
[Pipeline] // withEnv
[Pipeline] }
[Pipeline] // stage
[Pipeline] stage
[Pipeline] { (Package)
Stage "Package" skipped due to earlier failure(s)
[Pipeline] getContext
[Pipeline] }
[Pipeline] // stage
[Pipeline] }
[Pipeline] // withEnv
[Pipeline] }
[Pipeline] // node
[Pipeline] End of Pipeline
ERROR: script returned exit code 1
Finished: FAILURE

