Started by user admin

[Pipeline] Start of Pipeline
[Pipeline] node
Running on Jenkins
 in /var/lib/jenkins/workspace/Demo
[Pipeline] {
[Pipeline] stage
[Pipeline] { (Declarative: Tool Install)
[Pipeline] tool
[Pipeline] envVarsForTool
[Pipeline] tool
[Pipeline] envVarsForTool
[Pipeline] }
[Pipeline] // stage
[Pipeline] withEnv
[Pipeline] {
[Pipeline] stage
[Pipeline] { (Checkout)
[Pipeline] tool
[Pipeline] envVarsForTool
[Pipeline] tool
[Pipeline] envVarsForTool
[Pipeline] withEnv
[Pipeline] {
[Pipeline] git
The recommended git tool is: NONE
No credentials specified
 > git rev-parse --resolve-git-dir /var/lib/jenkins/workspace/Demo/.git # timeout=10
Fetching changes from the remote Git repository
 > git config remote.origin.url https://github.com/zatreby/jenkins-demo.git # timeout=10
Fetching upstream changes from https://github.com/zatreby/jenkins-demo.git
 > git --version # timeout=10
 > git --version # 'git version 2.51.2'
 > git fetch --tags --force --progress -- https://github.com/zatreby/jenkins-demo.git +refs/heads/*:refs/remotes/origin/* # timeout=10
 > git rev-parse refs/remotes/origin/main^{commit} # timeout=10
Checking out Revision ed6adbe7fb065bdfc1a6ab2e497d93af85bd76a0 (refs/remotes/origin/main)
 > git config core.sparsecheckout # timeout=10
 > git checkout -f ed6adbe7fb065bdfc1a6ab2e497d93af85bd76a0 # timeout=10
 > git branch -a -v --no-abbrev # timeout=10
 > git branch -D main # timeout=10
 > git checkout -b main ed6adbe7fb065bdfc1a6ab2e497d93af85bd76a0 # timeout=10
Commit message: "fix: remove failing test"
 > git rev-list --no-walk 9500a36ee68f9b9318350004b5f51d67abb577f5 # timeout=10
[Pipeline] }
[Pipeline] // withEnv
[Pipeline] }
[Pipeline] // stage
[Pipeline] stage
[Pipeline] { (Build)
[Pipeline] tool
[Pipeline] envVarsForTool
[Pipeline] tool
[Pipeline] envVarsForTool
[Pipeline] withEnv
[Pipeline] {
[Pipeline] echo
compiling...
[Pipeline] sh
+ mvn clean compile
WARNING: A terminally deprecated method in sun.misc.Unsafe has been called
WARNING: sun.misc.Unsafe::staticFieldBase has been called by com.google.inject.internal.aop.HiddenClassDefiner (file:/var/lib/jenkins/tools/hudson.tasks.Maven_MavenInstallation/Maven/lib/guice-5.1.0-classes.jar)
WARNING: Please consider reporting this to the maintainers of class com.google.inject.internal.aop.HiddenClassDefiner
WARNING: sun.misc.Unsafe::staticFieldBase will be removed in a future release
[INFO] Scanning for projects...
[INFO] 
[INFO] -----------------------< com.example:math-utils >-----------------------
[INFO] Building math-utils 1.0-SNAPSHOT
[INFO]   from pom.xml
[INFO] --------------------------------[ jar ]---------------------------------
[INFO] 
[INFO] --- clean:3.2.0:clean (default-clean) @ math-utils ---
[INFO] Deleting /var/lib/jenkins/workspace/Demo/target
[INFO] 
[INFO] --- resources:3.3.1:resources (default-resources) @ math-utils ---
[INFO] skip non existing resourceDirectory /var/lib/jenkins/workspace/Demo/src/main/resources
[INFO] 
[INFO] --- compiler:3.13.0:compile (default-compile) @ math-utils ---
[INFO] Recompiling the module because of changed source code.
[INFO] Compiling 1 source file with javac [debug target 17] to target/classes
[WARNING] location of system modules is not set in conjunction with -source 17
  not setting the location of system modules may lead to class files that cannot run on JDK 17
    --release 17 is recommended instead of -source 17 -target 17 because it sets the location of system modules automatically
[INFO] ------------------------------------------------------------------------
[INFO] BUILD SUCCESS
[INFO] ------------------------------------------------------------------------
[INFO] Total time:  0.571 s
[INFO] Finished at: 2025-12-12T15:18:31+02:00
[INFO] ------------------------------------------------------------------------
[Pipeline] }
[Pipeline] // withEnv
[Pipeline] }
[Pipeline] // stage
[Pipeline] stage
[Pipeline] { (Test)
[Pipeline] tool
[Pipeline] envVarsForTool
[Pipeline] tool
[Pipeline] envVarsForTool
[Pipeline] withEnv
[Pipeline] {
[Pipeline] echo
testing...
[Pipeline] sh
+ mvn test
WARNING: A terminally deprecated method in sun.misc.Unsafe has been called
WARNING: sun.misc.Unsafe::staticFieldBase has been called by com.google.inject.internal.aop.HiddenClassDefiner (file:/var/lib/jenkins/tools/hudson.tasks.Maven_MavenInstallation/Maven/lib/guice-5.1.0-classes.jar)
WARNING: Please consider reporting this to the maintainers of class com.google.inject.internal.aop.HiddenClassDefiner
WARNING: sun.misc.Unsafe::staticFieldBase will be removed in a future release
[INFO] Scanning for projects...
[INFO] 
[INFO] -----------------------< com.example:math-utils >-----------------------
[INFO] Building math-utils 1.0-SNAPSHOT
[INFO]   from pom.xml
[INFO] --------------------------------[ jar ]---------------------------------
[INFO] 
[INFO] --- resources:3.3.1:resources (default-resources) @ math-utils ---
[INFO] skip non existing resourceDirectory /var/lib/jenkins/workspace/Demo/src/main/resources
[INFO] 
[INFO] --- compiler:3.13.0:compile (default-compile) @ math-utils ---
[INFO] Nothing to compile - all classes are up to date.
[INFO] 
[INFO] --- resources:3.3.1:testResources (default-testResources) @ math-utils ---
[INFO] skip non existing resourceDirectory /var/lib/jenkins/workspace/Demo/src/test/resources
[INFO] 
[INFO] --- compiler:3.13.0:testCompile (default-testCompile) @ math-utils ---
[INFO] Recompiling the module because of changed source code.
[INFO] Compiling 1 source file with javac [debug target 17] to target/test-classes
[WARNING] location of system modules is not set in conjunction with -source 17
  not setting the location of system modules may lead to class files that cannot run on JDK 17
    --release 17 is recommended instead of -source 17 -target 17 because it sets the location of system modules automatically
[INFO] 
[INFO] --- surefire:3.0.0-M7:test (default-test) @ math-utils ---
[INFO] Using auto detected provider org.apache.maven.surefire.junitplatform.JUnitPlatformProvider
[INFO] 
[INFO] -------------------------------------------------------
[INFO]  T E S T S
[INFO] -------------------------------------------------------
[INFO] Running com.example.math.MathUtilsTest
[INFO] Tests run: 3, Failures: 0, Errors: 0, Skipped: 0, Time elapsed: 0.035 s - in com.example.math.MathUtilsTest
[INFO] 
[INFO] Results:
[INFO] 
[INFO] Tests run: 3, Failures: 0, Errors: 0, Skipped: 0
[INFO] 
[INFO] ------------------------------------------------------------------------
[INFO] BUILD SUCCESS
[INFO] ------------------------------------------------------------------------
[INFO] Total time:  1.386 s
[INFO] Finished at: 2025-12-12T15:18:34+02:00
[INFO] ------------------------------------------------------------------------
[Pipeline] }
[Pipeline] // withEnv
[Pipeline] }
[Pipeline] // stage
[Pipeline] stage
[Pipeline] { (Package)
[Pipeline] tool
[Pipeline] envVarsForTool
[Pipeline] tool
[Pipeline] envVarsForTool
[Pipeline] withEnv
[Pipeline] {
[Pipeline] echo
packaging...
[Pipeline] sh
+ mvn package
WARNING: A terminally deprecated method in sun.misc.Unsafe has been called
WARNING: sun.misc.Unsafe::staticFieldBase has been called by com.google.inject.internal.aop.HiddenClassDefiner (file:/var/lib/jenkins/tools/hudson.tasks.Maven_MavenInstallation/Maven/lib/guice-5.1.0-classes.jar)
WARNING: Please consider reporting this to the maintainers of class com.google.inject.internal.aop.HiddenClassDefiner
WARNING: sun.misc.Unsafe::staticFieldBase will be removed in a future release
[INFO] Scanning for projects...
[INFO] 
[INFO] -----------------------< com.example:math-utils >-----------------------
[INFO] Building math-utils 1.0-SNAPSHOT
[INFO]   from pom.xml
[INFO] --------------------------------[ jar ]---------------------------------
[INFO] 
[INFO] --- resources:3.3.1:resources (default-resources) @ math-utils ---
[INFO] skip non existing resourceDirectory /var/lib/jenkins/workspace/Demo/src/main/resources
[INFO] 
[INFO] --- compiler:3.13.0:compile (default-compile) @ math-utils ---
[INFO] Nothing to compile - all classes are up to date.
[INFO] 
[INFO] --- resources:3.3.1:testResources (default-testResources) @ math-utils ---
[INFO] skip non existing resourceDirectory /var/lib/jenkins/workspace/Demo/src/test/resources
[INFO] 
[INFO] --- compiler:3.13.0:testCompile (default-testCompile) @ math-utils ---
[INFO] Nothing to compile - all classes are up to date.
[INFO] 
[INFO] --- surefire:3.0.0-M7:test (default-test) @ math-utils ---
[INFO] Using auto detected provider org.apache.maven.surefire.junitplatform.JUnitPlatformProvider
[INFO] 
[INFO] -------------------------------------------------------
[INFO]  T E S T S
[INFO] -------------------------------------------------------
[INFO] Running com.example.math.MathUtilsTest
[INFO] Tests run: 3, Failures: 0, Errors: 0, Skipped: 0, Time elapsed: 0.035 s - in com.example.math.MathUtilsTest
[INFO] 
[INFO] Results:
[INFO] 
[INFO] Tests run: 3, Failures: 0, Errors: 0, Skipped: 0
[INFO] 
[INFO] 
[INFO] --- jar:3.4.1:jar (default-jar) @ math-utils ---
[INFO] Building jar: /var/lib/jenkins/workspace/Demo/target/math-utils-1.0-SNAPSHOT.jar
[INFO] ------------------------------------------------------------------------
[INFO] BUILD SUCCESS
[INFO] ------------------------------------------------------------------------
[INFO] Total time:  1.257 s
[INFO] Finished at: 2025-12-12T15:18:36+02:00
[INFO] ------------------------------------------------------------------------
[Pipeline] }
[Pipeline] // withEnv
[Pipeline] }
[Pipeline] // stage
[Pipeline] }
[Pipeline] // withEnv
[Pipeline] }
[Pipeline] // node
[Pipeline] End of Pipeline
Finished: SUCCESS

